{
	"$schema": "../printer-definition.schema.json",
	"name": "V-Core 4 IDEX",
	"description": "Ratical flagship 3d printer with the IDEX upgrade kit",
	"manufacturer": "Ratical",
	"releaseDate": "2024-04-26",
	"documentationLink": "",
	"image": "v-core-4-idex.png",
	"template": "v-core-4-idex.ts",
	"driverCountRequired": 9,
	"sizes": {
		"300": {
			"x": 300,
			"y": 300,
			"z": 300
		},
		"400": {
			"x": 400,
			"y": 400,
			"z": 400
		},
		"500": {
			"x": 500,
			"y": 500,
			"z": 500
		}
	},
	"bedMargin": {
		"x": [59.6, 59.6],
		"y": [14.35, 33.65]
	},
	"speedLimits": {
		"basic": {
			"accel": 3000,
			"velocity": 300,
			"z_accel": 50,
			"z_velocity": 30,
			"travel_accel": 3000,
			"travel_velocity": 300
		},
		"performance": {
			"accel": 10000,
			"velocity": 800,
			"z_accel": 600,
			"z_velocity": 50,
			"travel_velocity": 600,
			"travel_accel": 8000
		}
	},
	"kinematics": "hybrid-corexy-idex",
	"defaults": {
		"board": "btt-octopus-11",
		"toolheadAlignmentSystem": { "id": "ratical-vaoc", "connectedTo": "controlboard"},
		"toolheads": [
			{
				"axis": "x",
				"description": "The left toolhead",
				"extruder": "orbiter-2",
				"toolboard": "btt-ebb42-12",
				"hotend": "rapido-plus-uhf",
				"partFan": "4pin-toolboard",
				"hotendFan": "2pin-toolboard",
				"probe": "beacon",
				"xEndstop": "endstop-toolboard",
				"yEndstop": "endstop"
			},
			{
				"axis": "dual_carriage",
				"description": "The right toolhead",
				"extruder": "orbiter-2",
				"toolboard": "btt-ebb42-12",
				"hotend": "rapido-plus-uhf",
				"partFan": "4pin-toolboard",
				"hotendFan": "2pin-toolboard",
				"xEndstop": "endstop-toolboard",
				"yEndstop": "endstop"
			}
		],
		"rails": [
			{
				"axis": "x",
				"axisDescription": "The X axis motor for the left toolhead, located at the rear left of the printer",
				"current": 1.1,
				"driver": "BTT-TMC2209-13",
				"stepper": "LDO-42STH48-2504AC",
				"rotationDistance": 40,
				"microstepping": 16,
				"homingSpeed": 50,
				"performanceMode": {
					"current": 1.6
				}
			},
			{
				"axis": "dual_carriage",
				"axisDescription": "The X axis motor for the right toolhead, located at the rear right of the printer",
				"current": 1.1,
				"driver": "BTT-TMC2209-13",
				"stepper": "LDO-42STH48-2504AC",
				"rotationDistance": 40,
				"microstepping": 16,
				"homingSpeed": 50,
				"performanceMode": {
					"current": 1.6
				}
			},
			{
				"axis": "y",
				"axisDescription": "The left Y motor used for cartesian Y control in Hybrid CoreXY, located at the rear left of the printer",
				"current": 1.1,
				"driver": "BTT-TMC2209-13",
				"stepper": "LDO-42STH48-2504AC",
				"rotationDistance": 40,
				"microstepping": 16,
				"homingSpeed": 50,
				"performanceMode": {
					"current": 1.6
				}
			},
			{
				"axis": "y1",
				"axisDescription": "The right Y motor used for cartesian Y control in Hybrid CoreXY, located at the rear right of the printer",
				"current": 1.1,
				"driver": "BTT-TMC2209-13",
				"stepper": "LDO-42STH48-2504AC",
				"rotationDistance": 40,
				"microstepping": 16,
				"homingSpeed": 50,
				"performanceMode": {
					"current": 1.6
				}
			},
			{
				"axis": "z",
				"axisDescription": "The left Z motor for the kinematic bed",
				"current": 1.1,
				"driver": "BTT-TMC2209-13",
				"stepper": "LDO-42STH48-2504AC",
				"rotationDistance": 4,
				"microstepping": 16,
				"homingSpeed": 10,
				"performanceMode": {
					"current": 1.6
				}
			},
			{
				"axis": "z1",
				"axisDescription": "The rear Z motor for the kinematic bed",
				"current": 1.1,
				"driver": "BTT-TMC2209-13",
				"stepper": "LDO-42STH48-2504AC",
				"rotationDistance": 4,
				"microstepping": 16,
				"performanceMode": {
					"current": 1.6
				}
			},
			{
				"axis": "z2",
				"axisDescription": "The right Z motor for the kinematic bed",
				"current": 1.1,
				"driver": "BTT-TMC2209-13",
				"stepper": "LDO-42STH48-2504AC",
				"rotationDistance": 4,
				"microstepping": 16,
				"performanceMode": {
					"current": 1.6
				}
			},
			{
				"axis": "extruder",
				"axisDescription": "The extruder motor used for pushing filament through the left toolhead (T0)",
				"rotationDistance": 0,
				"current": 0.707,
				"driver": "BTT-TMC2209-13",
				"stepper": "LDO-36STH20-1004AHG"
			},
			{
				"axis": "extruder1",
				"axisDescription": "The extruder motor used for pushing filament through the right toolhead (T1)",
				"rotationDistance": 0,
				"current": 0.707,
				"driver": "BTT-TMC2209-13",
				"stepper": "LDO-36STH20-1004AHG"
			}
		]
	}
}
