{
	"$schema": "../printer-definition.schema.json",
	"name": "V-Core Pro v1.3",
	"manufacturer": "Ratical",
	"documentationLink": "https://github.com/coolio986/ratical/docs/printers/v-core-pro",
	"description": "Discontinued CoreXY printer from Ratical which comes in 3 sizes",
	"image": "v-core-pro.png",
	"template": "v-core-pro-printer.template.cfg",
	"driverCountRequired": 6,
	"sizes": {
		"300": {
			"x": 300,
			"y": 300,
			"z": 300
		},
		"400": {
			"x": 400,
			"y": 400,
			"z": 400
		},
		"500": {
			"x": 500,
			"y": 500,
			"z": 500
		}
	},
	"speedLimits": {
		"basic": {
			"accel": 3000,
			"velocity": 300,
			"z_accel": 15,
			"z_velocity": 30,
			"travel_accel": 3000,
			"travel_velocity": 300
		},
		"performance": {
			"accel": 10000,
			"velocity": 800,
			"z_accel": 600,
			"z_velocity": 30,
			"travel_velocity": 600,
			"travel_accel": 8000
		}
	},
	"defaults": {
		"board": "btt-skr-pro-12",
		"toolheads": [
			{
				"axis": "x",
				"extruder": "bmg",
				"hotend": "v6",
				"partFan": "4pin",
				"hotendFan": "2pin",
				"probe": "probe",
				"xEndstop": "sensorless",
				"yEndstop": "sensorless"
			}
		],
		"rails": [
			{
				"axis": "x",
				"axisDescription": "The A motor in the CoreXY system, located at the rear left of the printer",
				"current": 1.1,
				"driver": "BTT-TMC2209-13",
				"stepper": "LDO-42STH48-2504AC",
				"rotationDistance": 40,
				"homingSpeed": 50,
				"performanceMode": {
					"current": 1.6
				}
			},
			{
				"axis": "y",
				"axisDescription": "The B motor in the CoreXY system, located at the rear right of the printer",
				"current": 1.1,
				"driver": "BTT-TMC2209-13",
				"stepper": "LDO-42STH48-2504AC",
				"rotationDistance": 40,
				"homingSpeed": 50,
				"performanceMode": {
					"current": 1.6
				}
			},
			{
				"axis": "z",
				"axisDescription": "The left Z motor for the kinematic bed",
				"current": 1.1,
				"driver": "BTT-TMC2209-13",
				"stepper": "LDO-42STH48-2504AC",
				"rotationDistance": 8,
				"homingSpeed": 10,
				"performanceMode": {
					"current": 1.6
				}
			},
			{
				"axis": "z1",
				"axisDescription": "The rear Z motor for the kinematic bed",
				"current": 1.1,
				"driver": "BTT-TMC2209-13",
				"stepper": "LDO-42STH48-2504AC",
				"rotationDistance": 8,
				"performanceMode": {
					"current": 1.6
				}
			},
			{
				"axis": "z2",
				"axisDescription": "The right Z motor for the kinematic bed",
				"current": 1.1,
				"driver": "BTT-TMC2209-13",
				"stepper": "LDO-42STH48-2504AC",
				"rotationDistance": 8,
				"performanceMode": {
					"current": 1.6
				}
			},
			{
				"axis": "extruder",
				"axisDescription": "The extruder motor used on your toolhead",
				"current": 0.85,
				"rotationDistance": 0,
				"driver": "BTT-TMC2209-13",
				"stepper": "LDO-42STH25-1404MAC"
			}
		]
	}
}
