{
	"$schema": "../printer-definition.schema.json",
	"name": "V-Minion",
	"description": "A small 180x180x180mm bed slinger from Ratical",
	"manufacturer": "Ratical",
	"documentationLink": "https://github.com/coolio986/ratical/docs/printers/v-minion",
	"image": "v-minion.png",
	"template": "v-minion-printer.template.cfg",
	"driverCountRequired": 4,
	"sizes": {
		"180": {
			"x": 180,
			"y": 180,
			"z": 180
		}
	},
	"speedLimits": {
		"basic": {
			"accel": 3000,
			"velocity": 200,
			"z_accel": 200,
			"z_velocity": 15,
			"travel_accel": 3000,
			"travel_velocity": 200
		},
		"performance": {
			"accel": 15000,
			"velocity": 600,
			"z_accel": 600,
			"z_velocity": 15,
			"travel_accel": 8000,
			"travel_velocity": 600
		}
	},
	"defaults": {
		"board": "btt-skrat-10",
		"toolheads": [
			{
				"axis": "x",
				"extruder": "lgx-lite",
				"hotend": "dragonfly",
				"partFan": "4pin",
				"hotendFan": "2pin",
				"probe": "probe",
				"xEndstop": "endstop",
				"yEndstop": "endstop"
			}
		],
		"rails": [
			{
				"axis": "x",
				"axisDescription": "The X axis motor moves the print head left and right.",
				"current": 0.8,
				"performanceMode": {
					"current": 1.188,
					"homingSpeed": 100
				},
				"driver": "BTT-TMC2209-13",
				"stepper": "LDO-42STH40-1684AC",
				"homingSpeed": 50,
				"rotationDistance": 40
			},
			{
				"axis": "y",
				"axisDescription": "The Y axis motor moves the print bed forward and backward.",
				"current": 0.8,
				"performanceMode": {
					"current": 1.188,
					"homingSpeed": 100
				},
				"driver": "BTT-TMC2209-13",
				"stepper": "LDO-42STH40-1684AC",
				"homingSpeed": 50,
				"rotationDistance": 40
			},
			{
				"axis": "z",
				"axisDescription": "The Z axis motor moves the print head up and down.",
				"current": 0.8,
				"performanceMode": {
					"current": 1.188
				},
				"driver": "BTT-TMC2209-13",
				"stepper": "LDO-42STH40-1684AC",
				"rotationDistance": 4
			},
			{
				"axis": "extruder",
				"axisDescription": "The extruder motor used for your toolhead",
				"current": 0.707,
				"driver": "BTT-TMC2209-13",
				"stepper": "LDO-36STH20-1004AHG",
				"rotationDistance": 0
			}
		]
	}
}
