{
	"$schema": "../printer-definition.schema.json",
	"name": "V-Core 4.1 Hybrid",
	"description": "Ratical flagship 3d printer with the hybrid upgrade kit",
	"manufacturer": "Ratical",
	"releaseDate": "2042-05-25",
	"documentationLink": "",
	"image": "v-core-4-hybrid.png",
	"template": "v-core-4-1-hybrid.ts",
	"driverCountRequired": 8,
	"sizes": {
		"300": {
			"x": 300,
			"y": 300,
			"z": 300
		},
		"400": {
			"x": 400,
			"y": 400,
			"z": 400
		},
		"500": {
			"x": 500,
			"y": 500,
			"z": 500
		}
	},
	"bedMargin": {
		"x": [60.6, 59.55],
		"y": [14.35, 30]
	},
	"speedLimits": {
		"basic": {
			"accel": 3000,
			"velocity": 300,
			"z_accel": 50,
			"z_velocity": 30,
			"travel_accel": 3000,
			"travel_velocity": 300
		},
		"performance": {
			"accel": 10000,
			"velocity": 800,
			"z_accel": 600,
			"z_velocity": 50,
			"travel_velocity": 600,
			"travel_accel": 8000
		}
	},
	"kinematics": "hybrid-corexy",
	"defaults": {
		"board": "btt-octopus-11",
		"chamberLighting": { "id": "dayspring", "connectedTo": "controlboard" },
		"toolheads": [
			{
				"axis": "x",
				"description": "the V-Core toolhead",
				"extruder": "orbiter-2",
				"toolboard": "ldo-orbitool-o2s",
				"hotend": "rapido-plus-uhf",
				"partFan": "4pin-dedicated-toolboard",
				"hotendFan": "2pin-toolboard",
				"probe": "beacon",
				"xEndstop": "endstop-toolboard",
				"yEndstop": "endstop",
				"filamentSensor": {"id": "orbiter-smart-sensor", "connectedTo": "toolboard"}
			}
		],
		"rails": [
			{
				"axis": "x",
				"axisDescription": "The A axis motor for the toolhead, located at the rear left of the printer",
				"current": 1.1,
				"driver": "BTT-TMC2209-13",
				"stepper": "LDO-42STH48-2504AC",
				"rotationDistance": 40,
				"homingSpeed": 50,
				"performanceMode": {
					"current": 1.6
				}
			},
			{
				"axis": "x1",
				"axisDescription": "The B axis motor for the toolhead, located at the rear right of the printer",
				"current": 1.1,
				"driver": "BTT-TMC2209-13",
				"stepper": "LDO-42STH48-2504AC",
				"rotationDistance": 40,
				"homingSpeed": 50,
				"performanceMode": {
					"current": 1.6
				}
			},
			{
				"axis": "y",
				"axisDescription": "The left Y motor used for cartesian Y control in Hybrid CoreXY, located at the rear left of the printer",
				"current": 1.1,
				"driver": "BTT-TMC2209-13",
				"stepper": "LDO-42STH48-2504AC",
				"rotationDistance": 40,
				"homingSpeed": 50,
				"performanceMode": {
					"current": 1.6
				}
			},
			{
				"axis": "y1",
				"axisDescription": "The right Y motor used for cartesian Y control in Hybrid CoreXY, located at the rear right of the printer",
				"current": 1.1,
				"driver": "BTT-TMC2209-13",
				"stepper": "LDO-42STH48-2504AC",
				"rotationDistance": 40,
				"homingSpeed": 50,
				"performanceMode": {
					"current": 1.6
				}
			},
			{
				"axis": "z",
				"axisDescription": "The left Z motor for the kinematic bed",
				"current": 1.1,
				"driver": "BTT-TMC2209-13",
				"stepper": "LDO-42STH48-2504AC",
				"rotationDistance": 4,
				"homingSpeed": 10,
				"performanceMode": {
					"current": 1.6
				}
			},
			{
				"axis": "z1",
				"axisDescription": "The rear Z motor for the kinematic bed",
				"current": 1.1,
				"driver": "BTT-TMC2209-13",
				"stepper": "LDO-42STH48-2504AC",
				"rotationDistance": 4,
				"performanceMode": {
					"current": 1.6
				}
			},
			{
				"axis": "z2",
				"axisDescription": "The right Z motor for the kinematic bed",
				"current": 1.1,
				"driver": "BTT-TMC2209-13",
				"stepper": "LDO-42STH48-2504AC",
				"rotationDistance": 4,
				"performanceMode": {
					"current": 1.6
				}
			},
			{
				"axis": "extruder",
				"axisDescription": "The extruder motor used for pushing filament through the toolhead",
				"rotationDistance": 0,
				"current": 0.707,
				"driver": "BTT-TMC2209-13",
				"stepper": "LDO-36STH20-1004AHG"
			}
		]
	}
}
