{
	"$schema": "../printer-definition.schema.json",
	"name": "V0.1",
	"description": "Mini CoreXY printer from Voron Design",
	"manufacturer": "Voron Design",
	"documentationLink": "https://github.com/coolio986/ratical/docs/printers/v-minion",
	"image": "voron-v0.png",
	"template": "voron-v01-printer.template.cfg",
	"driverCountRequired": 4,
	"sizes": {
		"120": {
			"x": 120,
			"y": 120,
			"z": 120
		}
	},
	"speedLimits": {
		"basic": {
			"accel": 2000,
			"velocity": 200,
			"z_accel": 45,
			"z_velocity": 15,
			"travel_accel": 2000,
			"travel_velocity": 200
		},
		"performance": {
			"accel": 12000,
			"velocity": 600,
			"z_accel": 45,
			"z_velocity": 15,
			"square_corner_velocity": 6,
			"travel_accel": 8000,
			"travel_velocity": 600
		}
	},
	"defaults": {
		"board": "btt-skr-mini-e3-30",
		"toolheads": [
			{
				"axis": "x",
				"extruder": "mini-afterburner",
				"hotend": "dragonfly",
				"partFan": "4pin",
				"hotendFan": "2pin",
				"xEndstop": "endstop",
				"yEndstop": "endstop"
			}
		],
		"rails": [
			{
				"axis": "x",
				"axisDescription": "The A motor in the CoreXY system",
				"current": 0.5,
				"driver": "BTT-TMC2209-13",
				"stepper": "LDO-35STH48-1684AH",
				"microstepping": 128,
				"performanceMode": {
					"current": 1.0,
					"homingSpeed": 100
				},
				"rotationDistance": 40,
				"homingSpeed": 50
			},
			{
				"axis": "y",
				"axisDescription": "The B motor in the CoreXY system",
				"current": 0.5,
				"driver": "BTT-TMC2209-13",
				"stepper": "LDO-35STH48-1684AH",
				"microstepping": 128,
				"performanceMode": {
					"current": 1.0,
					"homingSpeed": 100
				},
				"rotationDistance": 40,
				"homingSpeed": 50
			},
			{
				"axis": "z",
				"axisDescription": "The Z motor that moves the bed",
				"current": 0.707,
				"driver": "BTT-TMC2209-13",
				"stepper": "LDO-42STH25-1004CL200E",
				"microstepping": 128,
				"performanceMode": {
					"current": 0.707,
					"homingSpeed": 100
				},
				"rotationDistance": 8,
				"homingSpeed": 50
			},
			{
				"axis": "extruder",
				"axisDescription": "The extruder motor used for your toolhead",
				"current": 0.35,
				"driver": "BTT-TMC2209-13",
				"stepper": "LDO-36STH17-1004AHG",
				"microstepping": 128,
				"rotationDistance": 0
			}
		]
	}
}
