{
	"$schema": "../printer-definition.schema.json",
	"name": "V-Core 4",
	"description": "Ratical flagship 3d printer in CoreXY mode",
	"releaseDate": "2024-04-26",
	"manufacturer": "Ratical",
	"documentationLink": "",
	"image": "v-core-4.png",
	"template": "v-core-4.ts",
	"driverCountRequired": 6,
	"bedMargin": {
		"x": [59.6, 57.8],
		"y": [14.35, 30]
	},
	"sizes": {
		"300": {
			"x": 300,
			"y": 300,
			"z": 300
		},
		"400": {
			"x": 400,
			"y": 400,
			"z": 400
		},
		"500": {
			"x": 500,
			"y": 500,
			"z": 500
		}
	},
	"speedLimits": {
		"basic": {
			"accel": 3000,
			"velocity": 300,
			"z_accel": 50,
			"z_velocity": 30,
			"travel_accel": 3000,
			"travel_velocity": 300
		},
		"performance": {
			"accel": 10000,
			"velocity": 800,
			"z_accel": 600,
			"z_velocity": 50,
			"travel_velocity": 600,
			"travel_accel": 8000
		}
	},
	"defaults": {
		"board": "btt-octopus-11",
		"toolheads": [
			{
				"axis": "x",
				"description": "The V-Core toolhead",
				"extruder": "orbiter-2",
				"toolboard": "btt-ebb42-12",
				"hotend": "rapido-plus-uhf",
				"partFan": "4pin-toolboard",
				"hotendFan": "2pin-toolboard",
				"probe": "beacon",
				"xEndstop": "endstop-toolboard",
				"yEndstop": "endstop"
			}
		],
		"rails": [
			{
				"axis": "x",
				"axisDescription": "The A motor in the CoreXY system, located at the rear left of the printer",
				"current": 1.1,
				"driver": "BTT-TMC2209-13",
				"stepper": "LDO-42STH48-2504AC",
				"rotationDistance": 40,
				"homingSpeed": 50,
				"performanceMode": {
					"current": 1.6
				}
			},
			{
				"axis": "y",
				"axisDescription": "The B motor in the CoreXY system, located at the rear right of the printer",
				"current": 1.1,
				"driver": "BTT-TMC2209-13",
				"stepper": "LDO-42STH48-2504AC",
				"rotationDistance": 40,
				"homingSpeed": 50,
				"performanceMode": {
					"current": 1.6
				}
			},
			{
				"axis": "z",
				"axisDescription": "The left Z motor for the kinematic bed",
				"current": 1.1,
				"driver": "BTT-TMC2209-13",
				"stepper": "LDO-42STH48-2504AC",
				"rotationDistance": 4,
				"homingSpeed": 10,
				"performanceMode": {
					"current": 1.6
				}
			},
			{
				"axis": "z1",
				"axisDescription": "The rear Z motor for the kinematic bed",
				"current": 1.1,
				"driver": "BTT-TMC2209-13",
				"stepper": "LDO-42STH48-2504AC",
				"rotationDistance": 4,
				"performanceMode": {
					"current": 1.6
				}
			},
			{
				"axis": "z2",
				"axisDescription": "The right Z motor for the kinematic bed",
				"current": 1.1,
				"driver": "BTT-TMC2209-13",
				"stepper": "LDO-42STH48-2504AC",
				"rotationDistance": 4,
				"performanceMode": {
					"current": 1.6
				}
			},
			{
				"axis": "extruder",
				"axisDescription": "The extruder motor used for pushing filament through the toolhead",
				"rotationDistance": 0,
				"current": 0.707,
				"driver": "BTT-TMC2209-13",
				"stepper": "LDO-36STH20-1004AHG"
			}
		]
	}
}
