{
	"$schema": "../printer-definition.schema.json",
	"name": "MK3S",
	"description": "The classic Prusa i3 MK3s from Prusa Research",
	"manufacturer": "Prusa",
	"documentationLink": "https://github.com/coolio986/ratical/docs/printers/prusa-mini",
	"image": "prusa-mk3s.webp",
	"template": "prusa-mk3s-printer.template.cfg",
	"driverCountRequired": 4,
	"speedLimits": {
		"basic": {
			"accel": 4000,
			"velocity": 240,
			"z_accel": 200,
			"z_velocity": 15
		}
	},
	"bedMargin": {
		"x": [0, 5],
		"y": [4, 2.5]
	},
	"sizes": {
		"255": {
			"x": 250,
			"y": 210,
			"z": 210
		}
	},
	"defaults": {
		"board": "prusa-einsy",
		"controllerFan": "none",
		"toolheads": [
			{
				"axis": "x",
				"extruder": "mk3s",
				"hotend": "v6",
				"partFan": "4pin-dedicated",
				"hotendFan": "4pin-dedicated",
				"probe": "superpinda",
				"xEndstop": "sensorless",
				"yEndstop": "sensorless"
			}
		],
		"rails": [
			{
				"axis": "x",
				"axisDescription": "The X axis motor moves the print head left and right.",
				"current": 0.4,
				"driver": "PRUSA-EINSY-RAMBO-TMC2130",
				"stepper": "LDO-42STH40-1684AC",
				"rotationDistance": 32,
				"microstepping": 16,
				"homingSpeed": 25
			},
			{
				"axis": "y",
				"axisDescription": "The Y axis motor moves the print bed forward and backward.",
				"current": 0.4,
				"driver": "PRUSA-EINSY-RAMBO-TMC2130",
				"stepper": "LDO-42STH40-1684AC",
				"rotationDistance": 32,
				"microstepping": 16,
				"homingSpeed": 25
			},
			{
				"axis": "z",
				"axisDescription": "The Z axis motor moves the print head up and down.",
				"current": 0.4,
				"driver": "PRUSA-EINSY-RAMBO-TMC2130",
				"stepper": "LDO-42STH40-1684AC",
				"rotationDistance": 8,
				"microstepping": 16
			},
			{
				"axis": "extruder",
				"axisDescription": "The extruder motor used for your toolhead",
				"current": 0.52,
				"driver": "PRUSA-EINSY-RAMBO-TMC2130",
				"stepper": "LDO-42STH40-1684AC",
				"rotationDistance": 0,
				"microstepping": 16
			}
		]
	}
}
