{
	"$schema": "../printer-definition.schema.json",
	"name": "V-Chonk 3Z (BETA)",
	"description": "Mostly 3d printed, \"use what you've got\" 3d printer, Ratical style. This variant uses 6 drivers for z-tilt leveling.",
	"manufacturer": "Ratical",
	"releaseDate": "2024-02-23",
	"documentationLink": "",
	"image": "v-chonk.png",
	"template": "v-chonk-3z-printer.template.cfg",
	"driverCountRequired": 6,
	"bedMargin": {
		"x": [0, 0],
		"y": [15, 0]
	},
	"sizes": {
		"180": {
			"x": 180,
			"y": 180,
			"z": 180
		}
	},
	"speedLimits": {
		"basic": {
			"accel": 3000,
			"velocity": 300,
			"z_accel": 50,
			"z_velocity": 10,
			"travel_accel": 3000,
			"travel_velocity": 300
		},
		"performance": {
			"accel": 10000,
			"velocity": 800,
			"z_accel": 200,
			"z_velocity": 15,
			"travel_velocity": 600,
			"travel_accel": 8000
		}
	},
	"kinematics": "corexy",
	"defaults": {
		"board": "btt-skrat-10",
		"toolheads": [
			{
				"axis": "x",
				"description": "The toolhead for the printer",
				"extruder": "orbiter-2",
				"toolboard": "btt-ebb42-12",
				"hotend": "rapido",
				"partFan": "4pin",
				"hotendFan": "2pin-toolboard",
				"probe": "superpinda",
				"xEndstop": "sensorless",
				"yEndstop": "sensorless"
			}
		],
		"rails": [
			{
				"axis": "x",
				"axisDescription": "The A axis motor for the toolhead, located at the rear left of the printer",
				"current": 1.1,
				"driver": "BTT-TMC2209-13",
				"stepper": "LDO-42STH48-2504AC",
				"rotationDistance": 40,
				"homingSpeed": 50,
				"performanceMode": {
					"current": 1.6
				}
			},
			{
				"axis": "y",
				"axisDescription": "The B axis motor for the toolhead, located at the rear right of the printer",
				"current": 1.1,
				"driver": "BTT-TMC2209-13",
				"stepper": "LDO-42STH48-2504AC",
				"rotationDistance": 40,
				"homingSpeed": 50,
				"performanceMode": {
					"current": 1.6
				}
			},
			{
				"axis": "z",
				"axisDescription": "The front left Z motors for the bed",
				"current": 0.85,
				"driver": "BTT-TMC2209-13",
				"stepper": "LDO-42STH25-1404MAC",
				"rotationDistance": 4,
				"homingSpeed": 10
			},
			{
				"axis": "z1",
				"axisDescription": "The rear Z motor for the bed",
				"current": 0.85,
				"driver": "BTT-TMC2209-13",
				"stepper": "LDO-42STH25-1404MAC",
				"rotationDistance": 4,
				"performanceMode": {
					"current": 1
				}
			},
			{
				"axis": "z2",
				"axisDescription": "The front right Z motor for the bed",
				"current": 0.85,
				"driver": "BTT-TMC2209-13",
				"stepper": "LDO-42STH25-1404MAC",
				"rotationDistance": 4,
				"performanceMode": {
					"current": 1
				}
			},
			{
				"axis": "extruder",
				"axisDescription": "The extruder motor used for pushing filament through the toolhead",
				"rotationDistance": 0,
				"current": 0.707,
				"driver": "BTT-TMC2209-13",
				"stepper": "LDO-36STH20-1004AHG"
			}
		]
	}
}
